{
  "accounting_semantics": {
    "bytes_requested": "atomic bundle bytes presented to each tier reached by the cascade",
    "bytes_transferred": "atomic bundle bytes served by the first tier that hits",
    "hierarchy": "inclusive: every hot resident must also be cold-resident",
    "phase_state": "cache residency carries across phases; metrics are attributed to the phase of each request",
    "request_cascade": "hot -> cold -> backing_store",
    "theoretical_stall": "source-tier fixed latency plus bytes/bandwidth under serial_no_overlap"
  },
  "cost_model": {
    "overlap_model": "serial_no_overlap",
    "tiers": {
      "backing_store": {
        "bandwidth_bytes_per_second": 1000000000,
        "fixed_latency_us": 1000
      },
      "cold": {
        "bandwidth_bytes_per_second": 10000000000,
        "fixed_latency_us": 50
      },
      "hot": {
        "bandwidth_bytes_per_second": 100000000000,
        "fixed_latency_us": 5
      }
    }
  },
  "inputs": {
    "manifest_sha256": "a08d803db9eeac54aff099eab27a4d3a66fec3eb657be65c469a74aa6e606228",
    "model": {
      "llama_cpp_revision": "4daaaa1a4dd26d6465f84891b854b5f7ddc03020",
      "name": "Kimi-K3-0.40B-F16.gguf",
      "published_gguf_revision": "88de02cf8fa37f87eb06daaed370ac9c3411d5ca",
      "sha256": "411c197b503e6fb9199a2b22115e32dc4e2cad803fb112b24967737b3bab26c7",
      "size": 784318432,
      "source_revision": "d853649387ffe8f48ce0198a29ac1a44205031f7"
    },
    "storage_map": {
      "entries": 56,
      "llama_cpp_revision": "4daaaa1a4dd26d6465f84891b854b5f7ddc03020",
      "schema_version": "expert-storage-map-v1",
      "sha256": "42af6acd1d1f2ea77aaa9750b28141670ce69009ba06b5ddca3f42c696b51151"
    },
    "trace": {
      "expert_requests": 504,
      "llama_cpp_revision": "92c4627e19219134ed42e24aa84a1514bf3dffa3",
      "records": 252,
      "run_id": "phase2-observer-f16-cpu-greedy32-v1",
      "schema_version": 1,
      "sha256": "1952895f05d7778fa9382e86b9dcaddf1549b330fe5aa034c5418479435111da"
    }
  },
  "manifest_description": "Illustrative fixed costs for deterministic accounting only; these are not measured skynet latencies or production predictions.",
  "scenarios": [
    {
      "cold_capacity": {
        "bytes": 0,
        "slots": 0
      },
      "hot_capacity": {
        "bytes": 0,
        "slots": 0
      },
      "name": "no-cache",
      "policies": {
        "belady_min": {
          "by_phase": {
            "DECODE": {
              "backing_store_request_rate": 1.0,
              "cache_activity": {
                "cold": {
                  "admissions": 0,
                  "evictions": 0
                },
                "hot": {
                  "admissions": 0,
                  "evictions": 0
                }
              },
              "logical_requests": 434,
              "per_layer_expert_skew": {
                "1": {
                  "experts": {
                    "0": 12,
                    "1": 12,
                    "2": 4,
                    "3": 3,
                    "4": 7,
                    "5": 14,
                    "6": 6,
                    "7": 4
                  },
                  "maximum_expert_share": 0.22580645161290322,
                  "requests": 62
                },
                "2": {
                  "experts": {
                    "0": 4,
                    "1": 4,
                    "2": 10,
                    "3": 10,
                    "4": 2,
                    "5": 14,
                    "6": 5,
                    "7": 13
                  },
                  "maximum_expert_share": 0.22580645161290322,
                  "requests": 62
                },
                "3": {
                  "experts": {
                    "0": 9,
                    "1": 6,
                    "2": 8,
                    "3": 8,
                    "4": 7,
                    "5": 8,
                    "6": 9,
                    "7": 7
                  },
                  "maximum_expert_share": 0.14516129032258066,
                  "requests": 62
                },
                "4": {
                  "experts": {
                    "0": 1,
                    "1": 5,
                    "2": 4,
                    "3": 6,
                    "4": 20,
                    "5": 2,
                    "6": 21,
                    "7": 3
                  },
                  "maximum_expert_share": 0.3387096774193548,
                  "requests": 62
                },
                "5": {
                  "experts": {
                    "0": 4,
                    "1": 4,
                    "2": 21,
                    "3": 19,
                    "4": 9,
                    "6": 1,
                    "7": 4
                  },
                  "maximum_expert_share": 0.3387096774193548,
                  "requests": 62
                },
                "6": {
                  "experts": {
                    "0": 1,
                    "1": 1,
                    "2": 7,
                    "3": 24,
                    "4": 1,
                    "5": 26,
                    "7": 2
                  },
                  "maximum_expert_share": 0.41935483870967744,
                  "requests": 62
                },
                "7": {
                  "experts": {
                    "0": 8,
                    "1": 1,
                    "2": 6,
                    "3": 26,
                    "4": 6,
                    "5": 13,
                    "7": 2
                  },
                  "maximum_expert_share": 0.41935483870967744,
                  "requests": 62
                }
              },
              "reuse_distance": {
                "cold_references": 17,
                "definition": "number of distinct atomic expert bundles referenced since the previous reference",
                "finite_references": 417,
                "histogram": {
                  "12": 35,
                  "13": 103,
                  "14": 27,
                  "16": 1,
                  "17": 1,
                  "18": 1,
                  "19": 8,
                  "20": 13,
                  "21": 20,
                  "22": 19,
                  "23": 11,
                  "24": 9,
                  "25": 9,
                  "26": 10,
                  "27": 4,
                  "28": 8,
                  "29": 13,
                  "30": 10,
                  "31": 11,
                  "32": 9,
                  "33": 7,
                  "34": 13,
                  "35": 3,
                  "36": 5,
                  "37": 9,
                  "38": 15,
                  "39": 11,
                  "40": 4,
                  "42": 3,
                  "43": 9,
                  "44": 4,
                  "45": 3,
                  "46": 1,
                  "47": 2,
                  "48": 1,
                  "49": 3,
                  "50": 2,
                  "cold": 17
                },
                "p50": 21,
                "p95": 43,
                "p99": 49
              },
              "theoretical_stall": {
                "mean": 1786.432,
                "overlap_model": "serial_no_overlap",
                "p50": 1786.432,
                "p95": 1786.432,
                "p99": 1786.432,
                "samples": 434,
                "total": 775311.488,
                "unit": "microseconds"
              },
              "tiers": {
                "backing_store": {
                  "bytes_requested": 341311488,
                  "bytes_transferred": 341311488,
                  "hit_rate": 1.0,
                  "hits": 434,
                  "miss_rate": 0.0,
                  "misses": 0,
                  "requests": 434
                },
                "cold": {
                  "bytes_requested": 341311488,
                  "bytes_transferred": 0,
                  "hit_rate": 0.0,
                  "hits": 0,
                  "miss_rate": 1.0,
                  "misses": 434,
                  "requests": 434
                },
                "hot": {
                  "bytes_requested": 341311488,
                  "bytes_transferred": 0,
                  "hit_rate": 0.0,
                  "hits": 0,
                  "miss_rate": 1.0,
                  "misses": 434,
                  "requests": 434
                }
              }
            },
            "PREFILL": {
              "backing_store_request_rate": 1.0,
              "cache_activity": {
                "cold": {
                  "admissions": 0,
                  "evictions": 0
                },
                "hot": {
                  "admissions": 0,
                  "evictions": 0
                }
              },
              "logical_requests": 70,
              "per_layer_expert_skew": {
                "1": {
                  "experts": {
                    "0": 3,
                    "1": 2,
                    "3": 2,
                    "6": 1,
                    "7": 2
                  },
                  "maximum_expert_share": 0.3,
                  "requests": 10
                },
                "2": {
                  "experts": {
                    "0": 2,
                    "1": 1,
                    "2": 2,
                    "3": 2,
                    "6": 1,
                    "7": 2
                  },
                  "maximum_expert_share": 0.2,
                  "requests": 10
                },
                "3": {
                  "experts": {
                    "0": 1,
                    "1": 2,
                    "2": 3,
                    "3": 1,
                    "5": 2,
                    "7": 1
                  },
                  "maximum_expert_share": 0.3,
                  "requests": 10
                },
                "4": {
                  "experts": {
                    "0": 1,
                    "1": 2,